date,cut_key,cut_name,store,item_name,raw_price,raw_unit,price_per_kg,postal_code,valid_to,item_id,flyer_id,retailer_url
2026-03-21,asparagus,Asparagus,Loblaws,ASPARAGUS,3.0,defaulted_lb,6.61,L4T0A1,2026-03-26T03:59:59+00:00,1000132143,7837844,
2026-03-21,asparagus,Asparagus,Metro,ASPERGES | ASPARAGUS,4.99,defaulted_lb,11.0,K1A0A1,2026-03-26T03:59:59+00:00,1000090624,7838031,
2026-03-21,asparagus,Asparagus,No Frills,"ASPARAGUS, 325 G",2.99,defaulted_lb,6.59,L4T0A1,2026-03-26T03:59:59+00:00,1000148596,7838425,
2026-03-21,asparagus,Asparagus,Provigo,"ASPARAGUS, 325 G",3.0,defaulted_lb,6.61,K1A0A1,2026-03-26T03:59:59+00:00,1000627556,7837881,
2026-03-21,asparagus,Asparagus,Sobeys,Asparagus,4.99,defaulted_lb,11.0,M5V3L9,2026-03-26T03:59:59+00:00,1000786031,7843431,
2026-03-21,asparagus,Asparagus,Zehrs,ASPARAGUS,3.0,defaulted_lb,6.61,N2L3G1,2026-03-26T03:59:59+00:00,1000198057,7838057,
2026-03-21,avocado,Avocados,Zehrs,"PC® EXTRA LARGE GREEN OR RED SEEDLESS GRAPES, 3.99 LB / 8.80 KG OR FARMER'S MARKET™ AVOCADOS, 5'S 3.99 EA",3.99,kg,3.99,N2L3G1,2026-03-26T03:59:59+00:00,1000302606,7838057,
2026-03-21,beef_blade_roast,Beef blade roast,Food Basics,FRESH BONELESS INSIDE BLADE ROAST OR FAMILY PACK STEAKS,11.99,defaulted_lb,26.43,M5V3L9,2026-03-26T03:59:59+00:00,1000516468,7838080,
2026-03-21,beef_blade_roast,Beef blade roast,IGA,BONELESS BOTTOM BLADE ROAST,6.88,defaulted_lb,15.17,K1A0A1,2026-03-26T03:59:59+00:00,1001203092,7842461,
2026-03-21,beef_blade_roast,Beef blade roast,Metro,RÔTI DE BAS DE PALETTE DÉSOSSÉ | BONELESS BOTTOM BLADE ROAST,12.99,defaulted_lb,28.64,K1A0A1,2026-03-26T03:59:59+00:00,1000092147,7838031,
2026-03-21,beef_brisket,Beef brisket,Fortinos,RACHEL'S CORNED BEEF BRISKET,7.99,defaulted_lb,17.61,M5V3L9,2026-03-26T03:59:59+00:00,1000658602,7837929,
2026-03-21,beef_brisket,Beef brisket,Loblaws,KOSHER PICKLED BEEF BRISKET,25.0,defaulted_lb,55.12,M5V3L9,2026-04-09T03:59:59+00:00,1000369203,7838648,
2026-03-21,beef_brisket,Beef brisket,Loblaws,RACHEL'S CORNED BEEF BRISKET,7.99,defaulted_lb,17.61,M5V3L9,2026-03-26T03:59:59+00:00,1000369701,7837874,
2026-03-21,beef_brisket,Beef brisket,Metro,SHEFA SINGLE BEEF BRISKET,23.99,defaulted_lb,52.89,M5V3L9,2026-04-02T03:59:59+00:00,1000219402,7838528,
2026-03-21,beef_ground_extra_lean,Ground beef (extra lean),Loblaws,"GRASS FED EXTRA LEAN GROUND BEEF, 450 G",8.5,defaulted_lb,18.74,L4T0A1,2026-03-26T03:59:59+00:00,1000153244,7837844,
2026-03-21,beef_ground_extra_lean,Ground beef (extra lean),Maxi,BŒUF HACHÉ EXTRA-MAIGRE | extra lean ground beef,9.0,defaulted_lb,19.84,K1A0A1,2026-03-26T03:59:59+00:00,999854658,7836354,
2026-03-21,beef_ground_extra_lean,Ground beef (extra lean),Zehrs,"GRASS FED EXTRA LEAN GROUND BEEF, 450 G",8.5,defaulted_lb,18.74,N2L3G1,2026-03-26T03:59:59+00:00,1000302016,7838057,
2026-03-21,beef_ground_lean,Ground beef (lean),FreshCo,Lean Ground Beef 450 g,9.0,defaulted_lb,19.84,M5V3L9,2026-03-26T03:59:59+00:00,999970128,7834668,
2026-03-21,beef_ground_lean,Ground beef (lean),Loblaws,"GRASS FED EXTRA LEAN GROUND BEEF, 450 G",8.5,defaulted_lb,18.74,L4T0A1,2026-03-26T03:59:59+00:00,1000153244,7837844,
2026-03-21,beef_ground_lean,Ground beef (lean),Maxi,BŒUF HACHÉ EXTRA-MAIGRE | extra lean ground beef,9.0,defaulted_lb,19.84,K1A0A1,2026-03-26T03:59:59+00:00,999854658,7836354,
2026-03-21,beef_ground_lean,Ground beef (lean),Metro,BOEUF HACHÉ MAIGRE | LEAN GROUND BEEF,8.99,defaulted_lb,19.82,K1A0A1,2026-03-26T03:59:59+00:00,1000091726,7838031,
2026-03-21,beef_ground_lean,Ground beef (lean),Metro,LEAN GROUND BEEF VALUE PACK,5.44,defaulted_lb,11.99,M5V3L9,2026-03-26T03:59:59+00:00,1000374058,7838110,
2026-03-21,beef_ground_lean,Ground beef (lean),No Frills,"SUFRA® HALAL LEAN GROUND BEEF, 454 g",7.49,defaulted_lb,16.51,L4T0A1,2026-03-26T03:59:59+00:00,1000151946,7838425,
2026-03-21,beef_ground_lean,Ground beef (lean),Sobeys,Fresh Lean Ground Beef Burgers,8.99,defaulted_lb,19.82,M5V3L9,2026-03-26T03:59:59+00:00,1000786157,7843431,
2026-03-21,beef_ground_lean,Ground beef (lean),Sobeys,Fresh Lean Ground Beef,6.99,defaulted_lb,15.41,M5V3L9,2026-03-26T03:59:59+00:00,1000785968,7843431,
2026-03-21,beef_ground_lean,Ground beef (lean),Sobeys,Fresh Lean Ground Beef,7.99,defaulted_lb,17.61,M5V3L9,2026-03-26T03:59:59+00:00,1000786145,7843431,
2026-03-21,beef_ground_lean,Ground beef (lean),Walmart,Your Fresh Market™ halal lean ground beef,8.78,defaulted_lb,19.36,M5V3L9,2026-03-26T03:59:59+00:00,999491404,7829202,
2026-03-21,beef_ground_lean,Ground beef (lean),Zehrs,"GRASS FED EXTRA LEAN GROUND BEEF, 450 G",8.5,defaulted_lb,18.74,N2L3G1,2026-03-26T03:59:59+00:00,1000302016,7838057,
2026-03-21,beef_ground_medium,Ground beef (medium),Food Basics,MEDIUM GROUND BEEF FAMILY PACK,4.87,defaulted_lb,10.74,M5V3L9,2026-03-26T03:59:59+00:00,1000498437,7838080,
2026-03-21,beef_ground_medium,Ground beef (medium),Fortinos,SHEFA MEDIUM GROUND BEEF,9.99,defaulted_lb,22.02,M5V3L9,2026-03-26T03:59:59+00:00,1000676997,7837929,
2026-03-21,beef_ground_medium,Ground beef (medium),Sobeys,"Fresh Premium Cheesy, & or Bacon & Cheddar Medium Ground Chuck Beef Burgers",9.99,defaulted_lb,22.02,M5V3L9,2026-03-26T03:59:59+00:00,1000786167,7843431,
2026-03-21,beef_ground_medium,Ground beef (medium),Sobeys,Fresh Medium Ground Chuck Beef Burgers,8.99,defaulted_lb,19.82,M5V3L9,2026-03-26T03:59:59+00:00,1000786164,7843431,
2026-03-21,beef_ground_regular,Ground beef (regular),Food Basics,MEDIUM GROUND BEEF FAMILY PACK,4.87,defaulted_lb,10.74,M5V3L9,2026-03-26T03:59:59+00:00,1000498437,7838080,
2026-03-21,beef_ground_regular,Ground beef (regular),Fortinos,SHEFA MEDIUM GROUND BEEF,9.99,defaulted_lb,22.02,M5V3L9,2026-03-26T03:59:59+00:00,1000676997,7837929,
2026-03-21,beef_ground_regular,Ground beef (regular),FreshCo,Lean Ground Beef 450 g,9.0,defaulted_lb,19.84,M5V3L9,2026-03-26T03:59:59+00:00,999970128,7834668,
2026-03-21,beef_ground_regular,Ground beef (regular),Loblaws,"GRASS FED EXTRA LEAN GROUND BEEF, 450 G",8.5,defaulted_lb,18.74,L4T0A1,2026-03-26T03:59:59+00:00,1000153244,7837844,
2026-03-21,beef_ground_regular,Ground beef (regular),Maxi,BŒUF HACHÉ EXTRA-MAIGRE | extra lean ground beef,9.0,defaulted_lb,19.84,K1A0A1,2026-03-26T03:59:59+00:00,999854658,7836354,
2026-03-21,beef_ground_regular,Ground beef (regular),Metro,BOEUF HACHÉ MAIGRE | LEAN GROUND BEEF,8.99,defaulted_lb,19.82,K1A0A1,2026-03-26T03:59:59+00:00,1000091726,7838031,
2026-03-21,beef_ground_regular,Ground beef (regular),Metro,LEAN GROUND BEEF VALUE PACK,5.44,defaulted_lb,11.99,M5V3L9,2026-03-26T03:59:59+00:00,1000374058,7838110,
2026-03-21,beef_ground_regular,Ground beef (regular),No Frills,"SUFRA® HALAL LEAN GROUND BEEF, 454 g",7.49,defaulted_lb,16.51,L4T0A1,2026-03-26T03:59:59+00:00,1000151946,7838425,
2026-03-21,beef_ground_regular,Ground beef (regular),Sobeys,"Fresh Premium Cheesy, & or Bacon & Cheddar Medium Ground Chuck Beef Burgers",9.99,defaulted_lb,22.02,M5V3L9,2026-03-26T03:59:59+00:00,1000786167,7843431,
2026-03-21,beef_ground_regular,Ground beef (regular),Sobeys,Fresh Lean Ground Beef,6.99,defaulted_lb,15.41,M5V3L9,2026-03-26T03:59:59+00:00,1000785968,7843431,
2026-03-21,beef_ground_regular,Ground beef (regular),Sobeys,Fresh Lean Ground Beef,7.99,defaulted_lb,17.61,M5V3L9,2026-03-26T03:59:59+00:00,1000786145,7843431,
2026-03-21,beef_ground_regular,Ground beef (regular),Sobeys,Fresh Medium Ground Chuck Beef Burgers,8.99,defaulted_lb,19.82,M5V3L9,2026-03-26T03:59:59+00:00,1000786164,7843431,
2026-03-21,beef_ground_regular,Ground beef (regular),Walmart,Your Fresh Market™ halal lean ground beef,8.78,defaulted_lb,19.36,M5V3L9,2026-03-26T03:59:59+00:00,999491404,7829202,
2026-03-21,beef_ground_regular,Ground beef (regular),Zehrs,"GRASS FED EXTRA LEAN GROUND BEEF, 450 G",8.5,defaulted_lb,18.74,N2L3G1,2026-03-26T03:59:59+00:00,1000302016,7838057,
2026-03-21,beef_inside_round,Beef inside round roast,Metro,PLATINUM GRILL ANGUS BONELESS INSIDE ROUND OR SIRLOIN TIP ROAST OR VALUE PACK STEAK,9.99,defaulted_lb,22.02,M5V3L9,2026-03-26T03:59:59+00:00,1000395642,7838110,
2026-03-21,beef_inside_round,Beef inside round roast,Sobeys,STERLING SILVER Fresh Boneless Inside Round Oven Roast or Marinating Steaks,7.99,defaulted_lb,17.61,M5V3L9,2026-03-26T03:59:59+00:00,1000785946,7843431,
2026-03-21,beef_sirloin,Beef top sirloin,Fortinos,SIRLOIN TIP STEAK,7.99,defaulted_lb,17.61,M5V3L9,2026-03-26T03:59:59+00:00,1000656765,7837929,
2026-03-21,beef_sirloin,Beef top sirloin,Loblaws,SIRLOIN TIP STEAK,7.99,defaulted_lb,17.61,M5V3L9,2026-03-26T03:59:59+00:00,1000405972,7837874,
2026-03-21,beef_sirloin,Beef top sirloin,Metro,"BIFTECK DE HAUT DE SURLONGE (BOSTON) DÉSOSSÉ SANS CULOTTE |BONELESS TOP SIRLOIN (BOSTON) STEAK, CAP OFF",15.99,defaulted_lb,35.25,K1A0A1,2026-03-26T03:59:59+00:00,1000091896,7838031,
2026-03-21,beef_sirloin,Beef top sirloin,Metro,PLATINUM GRILL ANGUS BONELESS INSIDE ROUND OR SIRLOIN TIP ROAST OR VALUE PACK STEAK,9.99,defaulted_lb,22.02,M5V3L9,2026-03-26T03:59:59+00:00,1000395642,7838110,
2026-03-21,beef_sirloin,Beef top sirloin,Sobeys,STERLING SILVER Fresh Boneless Top Sirloin Grilling Steaks Family Size or Premium Oven Roast,15.99,defaulted_lb,35.25,M5V3L9,2026-03-26T03:59:59+00:00,1000786199,7843431,
2026-03-21,beef_sirloin,Beef top sirloin,Walmart,Marcangelo pork sirloin roast,12.0,defaulted_lb,26.46,M5V3L9,2026-03-26T03:59:59+00:00,999702228,7832055,
2026-03-21,beef_stewing,Beef stewing cubes,Fortinos,"SUFRA® HALAL STEWING BEEF, 454 G",12.99,defaulted_lb,28.64,L4T0A1,2026-03-26T03:59:59+00:00,1000658357,7837930,
2026-03-21,beef_stewing,Beef stewing cubes,IGA,FRESH STEWING BEEF CUBES,9.99,defaulted_lb,22.02,K1A0A1,2026-03-26T03:59:59+00:00,1000637496,7842461,
2026-03-21,beef_stewing,Beef stewing cubes,No Frills,BONELESS STEWING BEEF,11.99,defaulted_lb,26.43,M5V3L9,2026-03-26T03:59:59+00:00,1000148042,7838433,
2026-03-21,beef_striploin,Beef striploin / NY strip,Metro,LIFE SMART NATURALIA GRASS FED BONELESS RIB STEAK OR STRIP LOIN STEAK,20.99,defaulted_lb,46.27,M5V3L9,2026-03-26T03:59:59+00:00,1000395656,7838110,
2026-03-21,carrots_bag,Carrots (bag),Chalo FreshCo,"Iceberg Lettuce Product of USA or Mexico No. 1 Grade Compliments Carrots or Yellow Onions 3 lb Bag Product of Ontario, Canada No. 1, 1.36 kg",2.99,kg,2.99,L4T0A1,2026-03-26T03:59:59+00:00,999751380,7834681,
2026-03-21,carrots_bag,Carrots (bag),FreshCo,"Iceberg Lettuce Product of USA or Mexico No. 1 Grade Compliments Carrots or Yellow Onions 3 lb Bag Product of Ontario, Canada No. 1, 1.36 kg",2.99,kg,2.99,M5V3L9,2026-03-26T03:59:59+00:00,999971949,7834668,
2026-03-21,chicken_breast,Chicken breast (boneless),Fortinos,PC® BLUE MENU BONELESS SKINLESS CHICKEN BREAST OR CLUB PACK OR MINA HALAL BONELESS SKINLESS CHICKEN BREAST,5.99,defaulted_lb,13.21,M5V3L9,2026-03-26T03:59:59+00:00,1000655875,7837929,
2026-03-21,chicken_breast,Chicken breast (boneless),FreshCo,Mina Halal Boneless Skinless Chicken Breasts 4 pieces,10.0,defaulted_lb,22.05,M5V3L9,2026-03-26T03:59:59+00:00,999904857,7834668,
2026-03-21,chicken_breast,Chicken breast (boneless),IGA,FRESH BONELESS CHICKEN BREASTS,8.49,defaulted_lb,18.72,K1A0A1,2026-03-26T03:59:59+00:00,1000637592,7842461,
2026-03-21,chicken_breast,Chicken breast (boneless),Loblaws,PC® BLUE MENU® BONELESS SKINLESS CHICKEN BREAST OR MINA HALAL BONELESS SKINLESS CHICKEN BREAST,5.99,defaulted_lb,13.21,M5V3L9,2026-03-26T03:59:59+00:00,1000348930,7837874,
2026-03-21,chicken_breast,Chicken breast (boneless),Metro,HAUTS DE CUISSES DE POULET DÉSOSSÉS | FRESH BONELESS CHICKEN BREASTS,8.99,defaulted_lb,19.82,K1A0A1,2026-03-26T03:59:59+00:00,1000091798,7838031,
2026-03-21,chicken_breast,Chicken breast (boneless),Metro,MAPLE LEAF PRIME RAISED WITHOUT ANTIBIOTICS FRESH CHICKEN BREAST FILLETS BONELESS SKINLESS,12.99,defaulted_lb,28.64,M5V3L9,2026-03-26T03:59:59+00:00,1000395682,7838110,
2026-03-21,chicken_breast,Chicken breast (boneless),Metro,POITRINES DE POULET DÉSOSSÉES EXCELDOR | EXCELDOR BONELESS CHICKEN BREASTS,9.99,defaulted_lb,22.02,K1A0A1,2026-03-26T03:59:59+00:00,1000092576,7838031,
2026-03-21,chicken_drumsticks,Chicken drumsticks,Food Basics,MAPLE LEAF PRIME RAISED WITHOUT ANTIBIOTICS CHICKEN DRUMSTICKS OR THIGHS FAMILY PACK,4.49,defaulted_lb,9.9,M5V3L9,2026-03-26T03:59:59+00:00,1000500330,7838080,
2026-03-21,chicken_drumsticks,Chicken drumsticks,Fortinos,PC® BLUE MENU® SKINLESS CHICKEN DRUMSTICKS,6.49,defaulted_lb,14.31,M5V3L9,2026-03-26T03:59:59+00:00,1000656834,7837929,
2026-03-21,chicken_drumsticks,Chicken drumsticks,IGA,PRIX CLUB FRESH CHICKEN DRUMSTICKS,18.0,defaulted_lb,39.68,K1A0A1,2026-03-26T03:59:59+00:00,1000637198,7842461,
2026-03-21,chicken_drumsticks,Chicken drumsticks,Loblaws,PC® BLUE MENU® SKINLESS CHICKEN DRUMSTICKS,6.49,defaulted_lb,14.31,M5V3L9,2026-03-26T03:59:59+00:00,1000349831,7837874,
2026-03-21,chicken_drumsticks,Chicken drumsticks,Maxi,"PILONS DE POULET SUFRA® HALAL | HALAL CHICKEN DRUMSTICKS, JUSQU' À 1,575 KG",14.0,kg,14.0,K1A0A1,2026-03-26T03:59:59+00:00,999862949,7836354,
2026-03-21,chicken_drumsticks,Chicken drumsticks,Metro,CUISSES DE POULET FRAIS AVEC DOS | FRESH CHICKEN LEGS WITH BACK,3.99,defaulted_lb,8.8,K1A0A1,2026-03-26T03:59:59+00:00,1000091924,7838031,
2026-03-21,chicken_drumsticks,Chicken drumsticks,Metro,FRESH CHICKEN LEG QUARTERS,1.99,defaulted_lb,4.39,M5V3L9,2026-03-26T03:59:59+00:00,1000374309,7838110,
2026-03-21,chicken_drumsticks,Chicken drumsticks,Metro,KEBAB FACTORY CHICKEN KEBABS OR LEG PIECES,8.99,defaulted_lb,19.82,M5V3L9,2026-03-26T03:59:59+00:00,1000907676,7838110,
2026-03-21,chicken_drumsticks,Chicken drumsticks,Metro,REPAS DEMI-CÔTES LEVÉES ET CUISSE DE POULET | HALF RIBS AND CHICKEN LEG MEAL,16.99,defaulted_lb,37.46,K1A0A1,2026-03-26T03:59:59+00:00,1000094374,7838031,
2026-03-21,chicken_drumsticks,Chicken drumsticks,No Frills,CHICKEN DRUMSTICKS,1.99,defaulted_lb,4.39,M5V3L9,2026-03-26T03:59:59+00:00,1000147285,7838433,
2026-03-21,chicken_drumsticks,Chicken drumsticks,No Frills,SUFRA® HALAL CHICKEN DRUMSTICKS fresh up to 840 g,8.0,defaulted_lb,17.64,L4T0A1,2026-03-26T03:59:59+00:00,1000151976,7838425,
2026-03-21,chicken_drumsticks,Chicken drumsticks,Provigo,CHICKEN DRUMSTICKS,2.49,defaulted_lb,5.49,K1A0A1,2026-03-26T03:59:59+00:00,1000627539,7837881,
2026-03-21,chicken_drumsticks,Chicken drumsticks,Sobeys,"COMPLIMENTS Fresh AIR-CHILLED Whole Chicken, Drumsticks or Bone-In Thighs",4.49,defaulted_lb,9.9,M5V3L9,2026-03-26T03:59:59+00:00,1000785970,7843431,
2026-03-21,chicken_drumsticks,Chicken drumsticks,Sobeys,BBQ Chicken Legs,9.99,defaulted_lb,22.02,M5V3L9,2026-03-26T03:59:59+00:00,1000786891,7843431,
2026-03-21,chicken_drumsticks,Chicken drumsticks,Sobeys,Marinated Fresh Chicken Drumsticks or Thighs,4.99,defaulted_lb,11.0,M5V3L9,2026-03-26T03:59:59+00:00,1000787007,7843431,
2026-03-21,chicken_ground,Ground chicken,Fortinos,"MINA HALAL EXTRA LEAN GROUND CHICKEN, 454 G",7.99,defaulted_lb,17.61,L4T0A1,2026-03-26T03:59:59+00:00,1000658358,7837930,
2026-03-21,chicken_ground,Ground chicken,Loblaws,"PC® BLUE MENU® GROUND CHICKEN, 454 G",8.0,defaulted_lb,17.64,L4T0A1,2026-03-26T03:59:59+00:00,1000227418,7837844,
2026-03-21,chicken_thigh_bonein,Chicken thighs (bone-in),Real Canadian Superstore,"SUFRA® HALAL CHICKEN DRUMS OR THIGHS, UP TO 1.58 KG",16.0,kg,16.0,M5V3L9,2026-03-26T03:59:59+00:00,1000085687,7837770,
2026-03-21,chicken_thigh_bonein,Chicken thighs (bone-in),Sobeys,"COMPLIMENTS Fresh AIR-CHILLED Whole Chicken, Drumsticks or Bone-In Thighs",4.49,defaulted_lb,9.9,M5V3L9,2026-03-26T03:59:59+00:00,1000785970,7843431,
2026-03-21,chicken_thigh_bonein,Chicken thighs (bone-in),Sobeys,"Fresh AIR-CHILLED Whole Chicken, Drumsticks or Bone-In Thighs",4.99,defaulted_lb,11.0,M5V3L9,2026-03-26T03:59:59+00:00,1000115944,7838506,
2026-03-21,chicken_thigh_bonein,Chicken thighs (bone-in),Walmart,Maple Leaf Prime bone-in chicken thighs raised without antibiotics,12.0,defaulted_lb,26.46,M5V3L9,2026-03-26T03:59:59+00:00,999678855,7832055,
2026-03-21,chicken_thigh_boneless,Chicken thighs (boneless),IGA,PRIX CLUB FRESH BONELESS CHICKEN THIGHS,25.0,defaulted_lb,55.12,K1A0A1,2026-03-26T03:59:59+00:00,1000637030,7842461,
2026-03-21,chicken_thigh_boneless,Chicken thighs (boneless),Metro,YORKSHIRE VALLEY FARMS ORGANIC FRESH BONELESS SKINLESS CHICKEN BREAST OR THIGHS,12.99,defaulted_lb,28.64,M5V3L9,2026-03-26T03:59:59+00:00,1000395720,7838110,
2026-03-21,chicken_thigh_boneless,Chicken thighs (boneless),Walmart,Mina halal boneless skinless chicken thighs,8.38,defaulted_lb,18.47,M5V3L9,2026-03-26T03:59:59+00:00,1000934548,7829202,
2026-03-21,chicken_whole,Whole chicken,Fortinos,YORKSHIRE VALLEY FARMS WHOLE CHICKEN,4.99,defaulted_lb,11.0,M5V3L9,2026-03-26T03:59:59+00:00,1000655947,7837929,
2026-03-21,chicken_whole,Whole chicken,IGA,EXCELDOR FRESH WHOLE CHICKENS,2.88,defaulted_lb,6.35,K1A0A1,2026-03-26T03:59:59+00:00,1001203042,7842461,
2026-03-21,chicken_whole,Whole chicken,IGA,FERME DES VOLTIGEURS ORGANIC WHOLE CHICKEN,6.49,defaulted_lb,14.31,K1A0A1,2026-03-26T03:59:59+00:00,1000637951,7842461,
2026-03-21,chicken_whole,Whole chicken,Loblaws,YORKSHIRE VALLEY FARMS WHOLE CHICKEN,4.99,defaulted_lb,11.0,M5V3L9,2026-03-26T03:59:59+00:00,1000406054,7837874,
2026-03-21,chicken_whole,Whole chicken,Metro,FRESH KOSHER CUT UP WHOLE CHICKEN,3.99,defaulted_lb,8.8,M5V3L9,2026-04-02T03:59:59+00:00,1000219516,7838528,
2026-03-21,chicken_whole,Whole chicken,Metro,POULET ENTIER | FRESH WHOLE CHICKEN,4.49,defaulted_lb,9.9,K1A0A1,2026-03-26T03:59:59+00:00,1000091719,7838031,
2026-03-21,chicken_whole,Whole chicken,Sobeys,"COMPLIMENTS Fresh AIR-CHILLED Whole Chicken, Drumsticks or Bone-In Thighs",4.49,defaulted_lb,9.9,M5V3L9,2026-03-26T03:59:59+00:00,1000785970,7843431,
2026-03-21,chicken_whole,Whole chicken,Sobeys,"Fresh AIR-CHILLED Whole Chicken, Drumsticks or Bone-In Thighs",4.99,defaulted_lb,11.0,M5V3L9,2026-03-26T03:59:59+00:00,1000115944,7838506,
2026-03-21,chicken_wings,Chicken wings,Food Basics,FRESH CHICKEN WINGS,3.99,defaulted_lb,8.8,M5V3L9,2026-03-26T03:59:59+00:00,1000499088,7838080,
2026-03-21,chicken_wings,Chicken wings,Metro,FRESH SPLIT CHICKEN WINGS,5.99,defaulted_lb,13.21,M5V3L9,2026-03-26T03:59:59+00:00,1000395674,7838110,
2026-03-21,chicken_wings,Chicken wings,No Frills,SPLIT CHICKEN WINGS OR PC® FREE FROM® SPLIT CHICKEN WINGS,4.99,defaulted_lb,11.0,M5V3L9,2026-03-26T03:59:59+00:00,1000148044,7838433,
2026-03-21,chicken_wings,Chicken wings,Zehrs,"PC® SPLIT CHICKEN WINGS, UP TO 990 G",14.0,defaulted_lb,30.86,N2L3G1,2026-03-26T03:59:59+00:00,1000194851,7838057,
2026-03-21,cod,Cod fillets,Maxi,"FILETS DE MORUE CHELSEA | COD FILLETS, 454 g",12.99,defaulted_lb,28.64,K1A0A1,2026-03-26T03:59:59+00:00,999863369,7836354,
2026-03-21,cod,Cod fillets,Metro,FOODFEST HADDOCK OR COD FILLETS,10.99,defaulted_lb,24.23,M5V3L9,2026-04-02T03:59:59+00:00,1000219548,7838528,
2026-03-21,cod,Cod fillets,No Frills,"CHELSEA COD FILLETS, 454 G",14.0,defaulted_lb,30.86,L4T0A1,2026-03-26T03:59:59+00:00,1000151751,7838425,
2026-03-21,cod,Cod fillets,Sobeys,40 FATHOMS Breaded Haddock or Cod Fillets,14.99,defaulted_lb,33.05,M5V3L9,2026-03-26T03:59:59+00:00,1000786214,7843431,
2026-03-21,grapes,Grapes,Chalo FreshCo,Green Seedless Grapes Product of South Africa No. 1 Grade 8.80/kg,3.99,kg,3.99,L4T0A1,2026-03-26T03:59:59+00:00,999751379,7834681,
2026-03-21,grapes,Grapes,Food Basics,GREEN OR RED SEEDLESS GRAPES,3.99,defaulted_lb,8.8,M5V3L9,2026-03-26T03:59:59+00:00,1000514532,7838080,
2026-03-21,grapes,Grapes,FreshCo,Green Seedless Grapes Product of South Africa No. 1 Grade 8.80/kg,3.99,kg,3.99,M5V3L9,2026-03-26T03:59:59+00:00,999970347,7834668,
2026-03-21,grapes,Grapes,Giant Tiger,Green seedless grapes,2.88,defaulted_lb,6.35,M5V3L9,2026-03-25T03:59:59+00:00,1000643423,7842221,
2026-03-21,grapes,Grapes,IGA,BLACK GRAPES,3.49,defaulted_lb,7.69,K1A0A1,2026-03-26T03:59:59+00:00,1000637907,7842461,
2026-03-21,grapes,Grapes,Loblaws,"PC® EXTRA LARGE GREEN OR RED SEEDLESS GRAPES, 3.99 LB OR FARMER'S MARKET™ AVOCADOS BAG, 5'S",3.99,lb,8.8,L4T0A1,2026-03-26T03:59:59+00:00,1000209240,7837844,
2026-03-21,grapes,Grapes,Metro,GROS RAISINS ROUGES OU NOIRS SANS PÉPINS | LARGE SEEDLESS RED OR BLACK GRAPES,1.97,defaulted_lb,4.34,K1A0A1,2026-03-26T03:59:59+00:00,1000089024,7838031,
2026-03-21,grapes,Grapes,Metro,RAISINS VERTS EXTRA GROS SANS PÉPINS | SEEDLESS EXTRA LARGE GREEN GRAPES,3.99,defaulted_lb,8.8,K1A0A1,2026-03-26T03:59:59+00:00,1000090468,7838031,
2026-03-21,grapes,Grapes,No Frills,GREEN or RED SEEDLESS GRAPES,3.99,defaulted_lb,8.8,M5V3L9,2026-03-26T03:59:59+00:00,1000148038,7838433,
2026-03-21,grapes,Grapes,Provigo,PC® EXTRA LARGE GREEN OR RED SEEDLESS GRAPES OR FARMER'S MARKET™ AVOCADO BAG,3.99,defaulted_lb,8.8,K1A0A1,2026-03-26T03:59:59+00:00,1000306789,7837881,
2026-03-21,grapes,Grapes,Walmart,Green seedless grapes,2.97,defaulted_lb,6.55,M5V3L9,2026-03-26T03:59:59+00:00,999684421,7832055,
2026-03-21,grapes,Grapes,Zehrs,"PC® EXTRA LARGE GREEN OR RED SEEDLESS GRAPES, 3.99 LB / 8.80 KG OR FARMER'S MARKET™ AVOCADOS, 5'S 3.99 EA",3.99,kg,3.99,N2L3G1,2026-03-26T03:59:59+00:00,1000302606,7838057,
2026-03-21,lamb_chops,Lamb chops,Loblaws,LAMB SHOULDER CHOPS CLUB PACK OR FROZEN GOAT CHOPS,6.0,defaulted_lb,13.23,L4T0A1,2026-03-26T03:59:59+00:00,1000179066,7837844,
2026-03-21,lamb_chops,Lamb chops,Real Canadian Superstore,"PC® FREE FROM ROSEMARY OR GARLIC LAMB LOIN CHOPS, 39.66/KG",17.99,kg,17.99,M5V3L9,2026-03-26T03:59:59+00:00,1000082893,7837770,
2026-03-21,lamb_chops,Lamb chops,Zehrs,LAMB SHOULDER CHOPS OR FROZEN GOAT CHOPS,6.0,defaulted_lb,13.23,N2L3G1,2026-03-26T03:59:59+00:00,1000162022,7838057,
2026-03-21,lamb_leg,Leg of lamb,Fortinos,WHOLE LAMB LEG,5.99,defaulted_lb,13.21,M5V3L9,2026-03-26T03:59:59+00:00,1000655986,7837929,
2026-03-21,lamb_leg,Leg of lamb,Sobeys,SUNGOLD Fresh Boneless Lamb Leg,12.99,defaulted_lb,28.64,M5V3L9,2026-03-26T03:59:59+00:00,1000786819,7843431,
2026-03-21,lettuce_romaine,Romaine lettuce,Chalo FreshCo,"Iceberg Lettuce Product of USA or Mexico No. 1 Grade Compliments Carrots or Yellow Onions 3 lb Bag Product of Ontario, Canada No. 1, 1.36 kg",2.99,kg,2.99,L4T0A1,2026-03-26T03:59:59+00:00,999751380,7834681,
2026-03-21,lettuce_romaine,Romaine lettuce,FreshCo,"Iceberg Lettuce Product of USA or Mexico No. 1 Grade Compliments Carrots or Yellow Onions 3 lb Bag Product of Ontario, Canada No. 1, 1.36 kg",2.99,kg,2.99,M5V3L9,2026-03-26T03:59:59+00:00,999971949,7834668,
2026-03-21,peppers,Bell peppers,Food Basics,MINI SWEET PEPPERS OR MINI CUCUMBERS,3.99,defaulted_lb,8.8,M5V3L9,2026-03-26T03:59:59+00:00,1000510740,7838080,
2026-03-21,peppers,Bell peppers,Food Basics,SWEET ASSORTED PEPPERS OR ROMAINE HEARTS,4.99,defaulted_lb,11.0,M5V3L9,2026-03-26T03:59:59+00:00,1000512562,7838080,
2026-03-21,peppers,Bell peppers,FreshCo,Sweet Bell Peppers 4 pk Product of Mexico,4.99,defaulted_lb,11.0,M5V3L9,2026-03-26T03:59:59+00:00,999879772,7834668,
2026-03-21,peppers,Bell peppers,Metro,MINI SWEET PEPPERS,4.99,defaulted_lb,11.0,M5V3L9,2026-03-26T03:59:59+00:00,1000393991,7838110,
2026-03-21,peppers,Bell peppers,No Frills,"RED, ORANGE or YELLOW SWEET PEPPERS",3.99,defaulted_lb,8.8,L4T0A1,2026-03-26T03:59:59+00:00,1000148757,7838425,
2026-03-21,pork_back_ribs,Pork back ribs,IGA,PLAISIRS GASTRONOMIQUES PORK BACK RIBS,14.99,defaulted_lb,33.05,K1A0A1,2026-03-26T03:59:59+00:00,1000633955,7842461,
2026-03-21,pork_back_ribs,Pork back ribs,Loblaws,"SWISS CHALET OR MONTANA'S PORK BACK RIBS, 600/650 G",15.0,defaulted_lb,33.07,L4T0A1,2026-03-26T03:59:59+00:00,1000223169,7837844,
2026-03-21,pork_back_ribs,Pork back ribs,Metro,CÔTES DE DOS DE PORC CUITES PLAISIRS GASTRONOMIQUES | PLAISIRS GASTRONOMIQUES COOKED PORK BACK RIBS,13.99,defaulted_lb,30.84,K1A0A1,2026-03-26T03:59:59+00:00,1000092595,7838031,
2026-03-21,pork_back_ribs,Pork back ribs,Metro,CÔTES DE DOS DE PORC FRAIS | FRESH PORK BACK RIBS,6.99,defaulted_lb,15.41,K1A0A1,2026-03-26T03:59:59+00:00,1000091997,7838031,
2026-03-21,pork_back_ribs,Pork back ribs,Metro,IRRESISTIBLE PORK BACK RIBS,12.99,defaulted_lb,28.64,M5V3L9,2026-03-26T03:59:59+00:00,1000396012,7838110,
2026-03-21,pork_back_ribs,Pork back ribs,Sobeys,Fresh Pork Loin Back Ribs or Fresh Pork Tenderloin,3.99,defaulted_lb,8.8,M5V3L9,2026-03-26T03:59:59+00:00,1000115915,7838506,
2026-03-21,pork_back_ribs,Pork back ribs,Zehrs,"SWISS CHALET OR MONTANA'S PORK BACK RIBS, 600/650 G",15.0,defaulted_lb,33.07,N2L3G1,2026-03-26T03:59:59+00:00,1000209516,7838057,
2026-03-21,pork_belly,Pork belly,Metro,FRESH PORK BELLIES,6.99,defaulted_lb,15.41,M5V3L9,2026-03-26T03:59:59+00:00,1000395663,7838110,
2026-03-21,pork_belly,Pork belly,Sobeys,"COMPLIMENTS Angus, Sirloin or Prime Rib Beef Burgers or Angus Beef & Pork Belly Burgers",15.99,defaulted_lb,35.25,M5V3L9,2026-03-26T03:59:59+00:00,1000786161,7843431,
2026-03-21,pork_chop_bonein,Pork chops (bone-in),Food Basics,LEGACY MARINATED BONE-IN PORK CHOPS,8.99,defaulted_lb,19.82,M5V3L9,2026-03-26T03:59:59+00:00,1000525372,7838080,
2026-03-21,pork_chop_boneless,Pork chops (boneless),Metro,CÔTELETTES DE PORC FRAIS DÉSOSSÉES | FRESH BONELESS PORK CHOPS,3.99,defaulted_lb,8.8,K1A0A1,2026-03-26T03:59:59+00:00,1000091874,7838031,
2026-03-21,pork_ground,Ground pork,Fortinos,LEAN GROUND PORK,3.99,defaulted_lb,8.8,M5V3L9,2026-03-26T03:59:59+00:00,1000656821,7837929,
2026-03-21,pork_ground,Ground pork,Loblaws,LEAN GROUND PORK,3.99,defaulted_lb,8.8,M5V3L9,2026-03-26T03:59:59+00:00,1000363966,7837874,
2026-03-21,pork_ground,Ground pork,No Frills,LEAN GROUND PORK,4.0,defaulted_lb,8.82,L4T0A1,2026-03-26T03:59:59+00:00,1000150746,7838425,
2026-03-21,pork_shoulder,Pork shoulder roast,IGA,FRESH BONELESS PORK SHOULDER ROAST,4.99,defaulted_lb,11.0,K1A0A1,2026-03-26T03:59:59+00:00,1000638532,7842461,
2026-03-21,pork_shoulder,Pork shoulder roast,Metro,ÉPAULE DE PORC OLYMEL | OLYMEL BONELESS PORK SHOULDER BUTT,4.99,defaulted_lb,11.0,K1A0A1,2026-03-26T03:59:59+00:00,1000092273,7838031,
